{
  "schema_version": "1.0",
  "name": "CBT Cards public resource catalog",
  "canonical": "https://cbt-cards.github.io/data/catalog.json",
  "updated": "2026-08-18",
  "license": "https://cbt-cards.github.io/LICENSE",
  "product": {
    "id": "cbt-cards",
    "name": "CBT Cards",
    "homepage": "https://cbt-cards.github.io/",
    "publisher": "MetalHatsCats",
    "category": "general wellness and self-reflection",
    "platforms": ["Android", "iOS"],
    "medical_scope": "Not medical advice, diagnosis, treatment, emergency support, or a substitute for professional care.",
    "privacy": "https://cbt-cards.github.io/privacy/",
    "support": "https://cbt-cards.github.io/support/",
    "stores": {
      "android": "https://play.google.com/store/apps/details?id=cbt.cbtcards.stressrelief",
      "ios": "https://apps.apple.com/us/app/cbt-cards-%D1%81bt-for-daily-use/id6737169041"
    }
  },
  "resources": [
    {"id": "resource-catalog", "type": "dataset", "url": "https://cbt-cards.github.io/data/catalog.json", "title": "CBT Cards public resource catalog", "format": "application/json", "updated": "2026-08-18", "schema_url": "https://cbt-cards.github.io/schemas/catalog-v1.schema.json"},
    {"id": "schema-manifest", "type": "schema-manifest", "url": "https://cbt-cards.github.io/schemas/index.json", "title": "CBT Cards public JSON Schema manifest", "format": "application/json", "updated": "2026-08-18"},
    {"id": "product-overview", "type": "product", "url": "https://cbt-cards.github.io/", "title": "CBT Cards"},
    {"id": "features", "type": "product", "url": "https://cbt-cards.github.io/features/", "title": "Features"},
    {"id": "how-it-works", "type": "product", "url": "https://cbt-cards.github.io/how-it-works/", "title": "How it works"},
    {"id": "privacy", "type": "policy", "url": "https://cbt-cards.github.io/privacy/", "title": "Privacy policy"},
    {"id": "faq", "type": "support", "url": "https://cbt-cards.github.io/faq/", "title": "FAQ"},
    {"id": "about", "type": "provenance", "url": "https://cbt-cards.github.io/about/", "title": "About CBT Cards"},
    {"id": "changelog", "type": "provenance", "url": "https://cbt-cards.github.io/changelog/", "title": "CBT Cards public changelog", "updated": "2026-08-18"},
    {"id": "changelog-data", "type": "dataset", "url": "https://cbt-cards.github.io/data/changelog.json", "title": "CBT Cards machine-readable changelog", "format": "application/json", "updated": "2026-08-18", "schema_url": "https://cbt-cards.github.io/schemas/changelog-v1.schema.json"},
    {"id": "learn", "type": "collection", "url": "https://cbt-cards.github.io/learn/", "title": "Learning library"},
    {"id": "cbt-thought-record", "type": "learning", "url": "https://cbt-cards.github.io/learn/cbt-thought-record/", "title": "CBT thought record", "reviewed": "2026-08-18"},
    {"id": "automatic-thoughts", "type": "learning", "url": "https://cbt-cards.github.io/learn/automatic-thoughts/", "title": "Automatic thoughts in CBT", "reviewed": "2026-08-18"},
    {"id": "thought-vs-fact", "type": "learning", "url": "https://cbt-cards.github.io/learn/thought-vs-fact/", "title": "Thought vs fact", "reviewed": "2026-08-18"},
    {"id": "worry-time", "type": "learning", "url": "https://cbt-cards.github.io/learn/worry-time/", "title": "Worry time", "reviewed": "2026-08-18"},
    {"id": "activity-planning", "type": "learning", "url": "https://cbt-cards.github.io/learn/activity-planning/", "title": "Activity planning", "reviewed": "2026-08-18"},
    {"id": "cbt-journaling", "type": "learning", "url": "https://cbt-cards.github.io/learn/cbt-journaling/", "title": "CBT journaling", "reviewed": "2026-08-18"},
    {"id": "worksheets", "type": "collection", "url": "https://cbt-cards.github.io/worksheets/", "title": "Free CBT reflection worksheets"},
    {"id": "worksheet-definitions", "type": "dataset", "url": "https://cbt-cards.github.io/data/worksheets.json", "title": "CBT Cards worksheet definitions", "format": "application/json", "locale": "en", "updated": "2026-08-18", "schema_url": "https://cbt-cards.github.io/schemas/worksheets-v1.schema.json"},
    {"id": "cbt-thought-record-7-step", "type": "worksheet", "url": "https://cbt-cards.github.io/worksheets/cbt-thought-record/", "title": "CBT thought record — 7-step worksheet", "reviewed": "2026-08-18"},
    {"id": "worry-time-6-step", "type": "worksheet", "url": "https://cbt-cards.github.io/worksheets/worry-time/", "title": "Worry time — 6-step worksheet", "reviewed": "2026-08-18"},
    {"id": "activity-planning-7-step", "type": "worksheet", "url": "https://cbt-cards.github.io/worksheets/activity-planning/", "title": "Activity planning — 7-step worksheet", "reviewed": "2026-08-18"},
    {"id": "toolkit", "type": "dataset-landing", "url": "https://cbt-cards.github.io/toolkit/", "title": "CBT Cards toolkit", "source_dataset": "metalhatscats-cbt-toolkit-v0.1.0"},
    {"id": "toolkit-review-page", "type": "provenance", "url": "https://cbt-cards.github.io/toolkit/review-status/", "title": "CBT Toolkit review status", "updated": "2026-08-18"},
    {"id": "toolkit-review-data", "type": "dataset", "url": "https://cbt-cards.github.io/data/toolkit-review.json", "title": "CBT Cards toolkit review overlay", "format": "application/json", "updated": "2026-08-18", "schema_url": "https://cbt-cards.github.io/schemas/toolkit-review-v1.schema.json"},
    {"id": "toolkit-cards", "type": "toolkit-collection", "url": "https://cbt-cards.github.io/toolkit/cards/", "title": "77 reflection cards", "source_dataset": "metalhatscats-cbt-toolkit-v0.1.0", "record_count": 77},
    {"id": "toolkit-metaphors", "type": "toolkit-collection", "url": "https://cbt-cards.github.io/toolkit/metaphors/", "title": "23 metaphors", "source_dataset": "metalhatscats-cbt-toolkit-v0.1.0", "record_count": 23},
    {"id": "toolkit-protocols", "type": "toolkit-collection", "url": "https://cbt-cards.github.io/toolkit/protocols/", "title": "15 protocol records", "source_dataset": "metalhatscats-cbt-toolkit-v0.1.0", "record_count": 15},
    {"id": "toolkit-source", "type": "dataset-metadata", "url": "https://cbt-cards.github.io/data/toolkit-source.json", "title": "CBT toolkit source metadata", "source_dataset": "metalhatscats-cbt-toolkit-v0.1.0", "schema_url": "https://cbt-cards.github.io/schemas/toolkit-source-v1.schema.json"},
    {"id": "source-card-4", "type": "toolkit-card", "url": "https://cbt-cards.github.io/toolkit/cards/challenge-your-thoughts/", "title": "Challenge Your Thoughts", "source_record_id": "card-4", "reviewed": "2026-08-18"},
    {"id": "source-card-15", "type": "toolkit-card", "url": "https://cbt-cards.github.io/toolkit/cards/worry-box/", "title": "Worry Box", "source_record_id": "card-15", "reviewed": "2026-08-18"},
    {"id": "source-card-16", "type": "toolkit-card", "url": "https://cbt-cards.github.io/toolkit/cards/big-goals-small-steps/", "title": "Big Goals, Small Steps", "source_record_id": "card-16", "reviewed": "2026-08-18"},
    {"id": "source-card-21", "type": "toolkit-card", "url": "https://cbt-cards.github.io/toolkit/cards/thoughts-are-not-facts/", "title": "Thoughts ≠ Facts", "source_record_id": "card-21", "reviewed": "2026-08-18"},
    {"id": "source-card-27", "type": "toolkit-card", "url": "https://cbt-cards.github.io/toolkit/cards/socratic-questioning/", "title": "Socratic Questioning", "source_record_id": "card-27", "reviewed": "2026-08-18"},
    {"id": "source-card-32", "type": "toolkit-card", "url": "https://cbt-cards.github.io/toolkit/cards/ground-yourself/", "title": "Ground Yourself", "source_record_id": "card-32", "reviewed": "2026-08-18"},
    {"id": "knowledge-dataset", "type": "dataset", "url": "https://cbt-cards.github.io/data/knowledge.jsonl", "title": "CBT Cards curated knowledge dataset", "format": "application/x-ndjson", "locale": "en", "updated": "2026-08-18", "schema_url": "https://cbt-cards.github.io/schemas/knowledge-record-v1.schema.json"},
    {"id": "atom-feed", "type": "feed", "url": "https://cbt-cards.github.io/feed.xml", "title": "CBT Cards Atom feed", "format": "application/atom+xml", "updated": "2026-08-18"},
    {"id": "json-feed", "type": "feed", "url": "https://cbt-cards.github.io/feed.json", "title": "CBT Cards JSON Feed", "format": "application/feed+json", "updated": "2026-08-18"},
    {"id": "security-contact", "type": "security", "url": "https://cbt-cards.github.io/.well-known/security.txt", "title": "CBT Cards security contact"},
    {"id": "agent-skill-latest", "type": "agent", "url": "https://cbt-cards.github.io/agents/cbt-cards/SKILL.md", "title": "CBT Cards agent skill (latest)", "version": "1.5.0", "mutable": true},
    {"id": "agent-skill-v1.1.0", "type": "agent", "url": "https://cbt-cards.github.io/agents/cbt-cards/v1.1.0/SKILL.md", "title": "CBT Cards agent skill v1.1.0", "version": "1.1.0", "mutable": false},
    {"id": "agent-skill-v1.2.0", "type": "agent", "url": "https://cbt-cards.github.io/agents/cbt-cards/v1.2.0/SKILL.md", "title": "CBT Cards agent skill v1.2.0", "version": "1.2.0", "mutable": false},
    {"id": "agent-skill-v1.3.0", "type": "agent", "url": "https://cbt-cards.github.io/agents/cbt-cards/v1.3.0/SKILL.md", "title": "CBT Cards agent skill v1.3.0", "version": "1.3.0", "mutable": false},
    {"id": "agent-skill-v1.4.0", "type": "agent", "url": "https://cbt-cards.github.io/agents/cbt-cards/v1.4.0/SKILL.md", "title": "CBT Cards agent skill v1.4.0", "version": "1.4.0", "mutable": false},
    {"id": "agent-skill-v1.5.0", "type": "agent", "url": "https://cbt-cards.github.io/agents/cbt-cards/v1.5.0/SKILL.md", "title": "CBT Cards agent skill v1.5.0", "version": "1.5.0", "mutable": false},
    {"id": "agent-skill-manifest", "type": "agent-manifest", "url": "https://cbt-cards.github.io/agents/cbt-cards/manifest.json", "title": "CBT Cards skill manifest", "schema_url": "https://cbt-cards.github.io/schemas/skill-manifest-v1.schema.json"}
  ]
}
